{
  "schemaVersion": 2,
  "matrixId": "voice-runtime-darwin-arm64-v2",
  "supportStatement": "macOS Apple Silicon only",
  "entries": [
    {
      "profileId": "english",
      "languageMode": "en",
      "platform": "darwin",
      "architecture": "arm64",
      "providerId": "autobyteus.voice.mlx-whisper-small",
      "modelId": "whisper-small-mlx-fp16",
      "candidateDecision": "preserve",
      "hostPackageId": "voice.host.english.mlx-whisper.darwin-arm64",
      "hostRecipeFileName": "english-host-darwin-arm64-v2.json",
      "modelAdmissionRoot": {
        "fileName": "english-darwin-arm64-v1.json",
        "sha256": "7cbf9799670b42482a29404c7a2acfb3a7f701a5e890d3cc22f3245bddfb5448"
      },
      "modelAssetId": "voice.model.english.whisper-small-mlx-fp16.v1",
      "modelManifest": {
        "fileName": "voice-model-english-whisper-small-mlx-fp16-v1.json",
        "sha256": "623ad1e90eb305e703f09a15e2325be2026aa39dea98bb34f1859ac953836593"
      },
      "compatibilityRequirementSha256": "70e676b166b2d5587ace83b6e9a5ee352a54fe1086cd45b55f6f4ef38cbb8b56",
      "capabilityDigest": "e69d9facc681a575e4b7e20b27434ce16ff502b19696bffc445dc6d43ec3f3a8"
    },
    {
      "profileId": "chinese",
      "languageMode": "zh",
      "platform": "darwin",
      "architecture": "arm64",
      "providerId": "autobyteus.voice.funasr-nano-q8",
      "modelId": "fun-asr-nano-gguf-q8",
      "candidateDecision": "select",
      "hostPackageId": "voice.host.chinese.funasr-native.darwin-arm64",
      "hostRecipeFileName": "chinese-host-darwin-arm64-v2.json",
      "modelAdmissionRoot": {
        "fileName": "chinese-darwin-arm64-v1.json",
        "sha256": "7a49df7e07d907818a02e3f5f12a58c47b5116d5e9deb2fd67caad1dcc97f0a8"
      },
      "modelAssetId": "voice.model.chinese.fun-asr-nano-gguf-q8.v1",
      "modelManifest": {
        "fileName": "voice-model-chinese-fun-asr-nano-gguf-q8-v1.json",
        "sha256": "09bf363a22ff7c98e53945e51544da09af0a96a7ad996b6ff991ef782a83c4da"
      },
      "compatibilityRequirementSha256": "217c57429dd08e1ff5e17c02c7cc95d947a07ac541e5f3220b8e6319b57675b2",
      "capabilityDigest": "e69d9facc681a575e4b7e20b27434ce16ff502b19696bffc445dc6d43ec3f3a8"
    }
  ],
  "profileResourcePolicy": {
    "policyId": "voice-runtime-profile-resource-policy-v1",
    "fileName": "profile-resource-policy-v1.json",
    "sha256": "d27110777f885f28569b6e53e7386a3d97e6c23cfe004efc295192b121663744"
  }
}
